{
  "speakers": {
    "dbPath": "H:/Media/Kurzykin/PROJECT/Titles_Template_NEW2025/work/json/speakers.json",
    "topicOptions": [
      "Новости",
      "Специальный репортаж",
      "Транснефть помогает",
      "Волонтеры Транснефти",
      "Люди компании",
      "Новость дня",
      "Оптимум",
      "Спорт"
    ]
  },
  "logging": {
    "enable": false,
    "root": ""
  },
  "subtitle": {
    "charsPerLine": 60,
    "shortWordMaxLen": 3,
    "bgGapSec": 3.0
  },
  "paths": {
    "dataRoot": "%USERPROFILE%/CaptionPanelsLocal/CaptionPanelsData",
    "toolsRoot": "%USERPROFILE%/CaptionPanelsLocal/CaptionPanelTools",
    "word2jsonExePath": "%USERPROFILE%/CaptionPanelsLocal/CaptionPanelTools/word2json/word2json.exe",
    "word2jsonOutDir": "%USERPROFILE%/CaptionPanelsLocal/CaptionPanelsData/word2json",
    "word2jsonLogsDir": "%USERPROFILE%/CaptionPanelsLocal/CaptionPanelsData/auto_timing/logs",
    "autoTimingOutDir": "%USERPROFILE%/CaptionPanelsLocal/CaptionPanelsData/auto_timing",
    "autoTimingBlocksDir": "%USERPROFILE%/CaptionPanelsLocal/CaptionPanelsData/auto_timing/blocks",
    "autoTimingWhisperXDir": "%USERPROFILE%/CaptionPanelsLocal/CaptionPanelsData/auto_timing/whisperx",
    "autoTimingAlignmentDir": "%USERPROFILE%/CaptionPanelsLocal/CaptionPanelsData/auto_timing/alignment",
    "autoTimingLogsDir": "%USERPROFILE%/CaptionPanelsLocal/CaptionPanelsData/auto_timing/logs",
    "ffmpegExePath": "%USERPROFILE%/CaptionPanelsLocal/CaptionPanelTools/ffmpeg/ffmpeg.exe"
  },
  "asr": {
    "whisperxPythonPath": "%USERPROFILE%/CaptionPanelsLocal/CaptionPanelTools/whisperx/.venv/Scripts/python.exe",
    "runnerScriptPath": "host/tools/whisperx_runner/run_whisperx.py",
    "model": "medium",
    "language": "ru",
    "deviceMode": "auto",
    "device": "cuda",
    "vadMethod": "silero",
    "offlineOnly": false,
    "applyTimeShift": false,
    "minGapFrames": 1,
    "advancedArgsEnabled": false,
    "beamSize": 5,
    "temperature": 0.0,
    "noSpeechThreshold": 0.6,
    "logprobThreshold": -1.0,
    "conditionOnPreviousText": false,
    "extraArgs": ""
  },
  "transcribe": {
    "alignScriptPath": "host/tools/transcribe_align/transcribe_align.py"
  }
}
